Contact Date, Employer Name, Job Title, Location, Contact Method, Results
03/03/2025, Dropbox, Software Engineer, Remote, 5Other, 1Applied						
03/03/2025, Zendesk, Backend Software Engineer, Remote, 5Other, 1Applied			
03/03/2025, MongoDB, Senior Software Engineer, Remote, 5Other, 1Applied						
03/03/2025, Atlassian, Full Stack Engineer, Remote, 5Other, 1Applied			
03/05/2025, Intuit, Software Engineer II, Seattle WA (Remote), 5Other, 1Applied			
03/05/2025, Asana, Senior Software Engineer, Remote, 5Other, 1Applied			
03/05/2025, Shopify, Engineering Manager, Remote, 5Other, 1Applied						
03/05/2025, Oracle, Principal Software Engineer, Remote, 5Other, 1Applied	
03/06/2025, Stripe, Engineering Director, Remote, 5Other, 1Applied
03/06/2025, Adobe, Software Engineering Lead, Remote, 5Other, 1Applied						
03/08/2025, Salesforce, Senior Software Architect, Portland OR, 5Other, 1Applied
